{
  "$schema": "https://json-schema.org/draft/2020-12/schema",
  "$id": "https://jungial.local/schemas/dream_weather.schema.json",
  "title": "DreamWeatherV1",
  "type": "object",
  "required": [
    "schema",
    "schemaVersion",
    "weatherId",
    "mood",
    "pressure",
    "ceiling",
    "dreadBudget",
    "weatherTags",
    "suppressedTags",
    "atmosphere"
  ],
  "properties": {
    "schema": { "const": "DreamWeatherV1" },
    "schemaVersion": { "const": 1 },
    "weatherId": { "type": "string", "minLength": 1 },
    "mood": { "enum": ["stillness", "hush", "gravity", "flicker", "bloom", "eclipse"] },
    "pressure": { "enum": ["low", "medium", "heavy", "storm"] },
    "ceiling": { "type": "number", "minimum": 0, "maximum": 1 },
    "dreadBudget": { "$ref": "dread_budget.schema.json" },
    "weatherTags": { "type": "array", "items": { "$ref": "#/$defs/weatherTag" } },
    "suppressedTags": { "type": "array", "items": { "$ref": "#/$defs/weatherTag" } },
    "atmosphere": {
      "type": "object",
      "required": ["lightIntensity", "fogDensity", "bloom", "exposure", "warmth", "movementDrag"],
      "properties": {
        "lightIntensity": { "type": "number", "minimum": 0, "maximum": 1 },
        "fogDensity": { "type": "number", "minimum": 0, "maximum": 1 },
        "bloom": { "type": "number", "minimum": 0, "maximum": 1 },
        "exposure": { "type": "number", "minimum": 0, "maximum": 1 },
        "warmth": { "type": "number", "minimum": 0, "maximum": 1 },
        "movementDrag": { "type": "number", "minimum": 0, "maximum": 1 }
      },
      "additionalProperties": false
    }
  },
  "additionalProperties": false,
  "$defs": {
    "weatherTag": {
      "enum": [
        "silence",
        "threshold",
        "soft_lamp",
        "mirror",
        "ash",
        "mist",
        "static",
        "gravity",
        "garden",
        "warmth",
        "cold",
        "distant_voice",
        "watching",
        "boundless",
        "contained",
        "pursuit",
        "bodyUnease",
        "cosmicDread",
        "disorientation",
        "loss",
        "claustrophobia",
        "annihilation",
        "rebirth",
        "cosmic_mystery",
        "reflection",
        "shadow",
        "self_observation",
        "safety",
        "memory",
        "hearth",
        "containment",
        "growth",
        "innocence",
        "fertility",
        "beauty",
        "dissolution",
        "void",
        "star",
        "unknown",
        "invitation",
        "door",
        "breath",
        "lamp"
      ]
    }
  }
}
